{
  "$schema": "https://json-schema.org/draft/2020-12/schema",
  "type": "object",
  "required": ["correlation_id", "node_type", "trace_entries"],
  "properties": {
    "correlation_id": { "type": "string" },
    "node_type": { "type": "string" },
    "trace_entries": {
      "type": "array",
      "minItems": 1,
      "items": {
        "type": "object",
        "required": ["field_path", "source", "evidence", "confidence"],
        "properties": {
          "field_path": { "type": "string", "pattern": "^[\\w\\.\\[\\]\\*]+$" },
          "source": { "enum": ["SOURCE_CODE", "API_DOCS", "ASSUMPTION"] },
          "evidence": { "type": "string", "minLength": 10 },
          "confidence": { "enum": ["high", "medium", "low"] },
          "assumption_rationale": { "type": "string" },
          "source_file": { "type": "string" },
          "line_range": { "type": "string" },
          "excerpt_hash": { "type": "string" },
          "verified": { "type": "boolean", "default": false }
        },
        "additionalProperties": false
      }
    },
    "generated_at": { "type": "string" },
    "skill_version": { "type": "string" }
  },
  "additionalProperties": false
}
